title,pubDate,guid,description
Oscars 2024: Barbie's Greta Gerwig and Margot Robbie miss key nominations,"Tue, 23 Jan 2024 17:43:24 GMT",https://www.bbc.co.uk/news/entertainment-arts-68067404,The director and star of Barbie were snubbed in major categories at the Oscar nominations on Tuesday.
Man held for murder over South Africa building fire,"Tue, 23 Jan 2024 20:57:03 GMT",https://www.bbc.co.uk/news/world-africa-68074917,The man told a public inquiry he started a Johannesburg building fire that killed 77 people last August.
Khan Younis: Israel says forces have encircled Gaza's second city,"Tue, 23 Jan 2024 21:15:25 GMT",https://www.bbc.co.uk/news/world-middle-east-68074566,"Fighting is reported around hospitals in the city, where Israel believes Hamas leaders are hiding."
"Post Office: I was only doing my job, says investigator","Tue, 23 Jan 2024 17:49:52 GMT",https://www.bbc.co.uk/news/business-68058412,Robert Daily told an inquiry into the Post Office scandal that he did not accept personal responsibility.
"Boys made fun of schoolgirl before death, inquest told","Tue, 23 Jan 2024 22:07:31 GMT",https://www.bbc.co.uk/news/uk-england-london-68071440,The 14-year-old was found dead at her family home in Harrow in March 2021.
Hinkley C: UK nuclear plant price tag could rocket by a third,"Tue, 23 Jan 2024 22:13:40 GMT",https://www.bbc.co.uk/news/business-68073279,EDF says final costs could soar by about a third as it faces a delayed completion date.
Woolies could return to British High Streets,"Tue, 23 Jan 2024 16:57:25 GMT",https://www.bbc.co.uk/news/business-68068503,"The owner of Woolworth Germany says bringing the brand back to the UK is on his ""bucket list""."
UK weather: Why have there been so many storms this year?,"Tue, 23 Jan 2024 16:01:01 GMT",https://www.bbc.co.uk/news/uk-68070561,The current season has brought the most Met Office named storms since records began in 2015/16.
Nottingham attacks: Victims' families condemn 'savage' killer,"Tue, 23 Jan 2024 19:16:24 GMT",https://www.bbc.co.uk/news/uk-england-nottinghamshire-68074779,Valdo Calocane faces the families of three people he stabbed to death in court.
Oscar nominations 2024: The full list of nominees,"Tue, 23 Jan 2024 13:01:43 GMT",https://www.bbc.co.uk/news/entertainment-arts-68069049,"Find out all the nominees for this year's Academy Awards, which were revealed on Tuesday."
US man to be executed by untested nitrogen gas tells of 'panic',"Mon, 22 Jan 2024 21:50:41 GMT",https://www.bbc.co.uk/news/world-us-canada-68053917,"Kenneth Smith, the first US man facing execution by nitrogen gas, says waiting on death row is like torture."
Bills and border crisis drive Trump voters to polls,"Tue, 23 Jan 2024 14:04:56 GMT",https://www.bbc.co.uk/news/world-us-canada-68053918,Voters in New Hampshire backing the former president say the economy is the key issue driving their support.
Kim Jong Un: Is North Korea's leader actually considering war?,"Tue, 23 Jan 2024 12:39:23 GMT",https://www.bbc.co.uk/news/world-asia-68052515,Kim Jong Un's recent military actions and a significant departure in ideology has worried watchers.
"UAE has funded political assassinations in Yemen, BBC finds","Tue, 23 Jan 2024 02:50:08 GMT",https://www.bbc.co.uk/news/world-middle-east-67945137,"The United Arab Emirates has paid for the killing of its political enemies in Yemen, whistleblowers say."
'Send back our husbands' - Russian women in rare protest,"Tue, 23 Jan 2024 05:57:11 GMT",https://www.bbc.co.uk/news/world-europe-68056939,A group of Russian women are making rare public demands for reservists to return from the front line.
Photographer Rankin reflects on his career and charity work,"Tue, 23 Jan 2024 03:08:05 GMT",https://www.bbc.co.uk/news/entertainment-arts-68035756,"Renowned photographer Rankin talks about his latest charity campaign, beauty and making the King laugh."
Who are the Houthis and why are they attacking Red Sea ships?,"Tue, 23 Jan 2024 08:39:20 GMT",https://www.bbc.co.uk/news/world-middle-east-67614911,The Houthis in Yemen have vowed to attack all ships in the Red Sea that are linked to Israel.
Storm names 2024: How do new storms like Jocelyn and Isha get their names?,"Tue, 23 Jan 2024 18:57:19 GMT",https://www.bbc.co.uk/news/uk-67135325,The 10th named storm of the season lands in the UK just days after Isha brings heavy rain and strong winds.
Worthing man running length of Africa halted by visa issue,"Tue, 23 Jan 2024 18:51:54 GMT",https://www.bbc.co.uk/news/uk-england-sussex-68068966,"Russell Cook, nicknamed ""Hardest Geezer"", says the mission is in doubt over Algerian visa issues."
Which films are the favourites for the Oscars?,"Tue, 23 Jan 2024 16:07:35 GMT",https://www.bbc.co.uk/news/entertainment-arts-68073766,Three films are expected to dominate the Oscars after the nominations were announced for the 96th Academy awards.
UK not seeking confrontation with Houthis - Sunak,"Tue, 23 Jan 2024 17:26:37 GMT",https://www.bbc.co.uk/news/uk-68069539,"The prime minister says the Iran-backed group poses an ""immediate threat"" to merchant shipping."
Lincolnshire Wildlife Park: Live outside the sweary parrots' enclosure,"Tue, 23 Jan 2024 12:07:47 GMT",https://www.bbc.co.uk/news/uk-68067531,"The birds would be ""taken off air"" if viewers could hear what they were saying, says the park CEO."
Alarming 30-fold rise in measles in Europe last year - WHO,"Tue, 23 Jan 2024 14:05:55 GMT",https://www.bbc.co.uk/news/health-68068226,"Urgent measures are needed now to stop further spread, the World Health Organization says."
Colin Firth to play Jim Swire in Lockerbie disaster series,"Tue, 23 Jan 2024 17:55:57 GMT",https://www.bbc.co.uk/news/uk-scotland-south-scotland-68074033,The Oscar-winning actor will take the part of the man whose daughter died in the 1988 disaster.
Frank Farian: Boney M founder dies aged 82,"Tue, 23 Jan 2024 14:00:03 GMT",https://www.bbc.co.uk/news/entertainment-arts-68065904,"The German producer was behind a string of hits including Daddy Cool, Rasputin and Rivers of Babylon."
"Stanley cups: Woman arrested for stealing $2,500 of quenchers","Tue, 23 Jan 2024 11:09:54 GMT",https://www.bbc.co.uk/news/world-us-canada-68067495,The 23-year-old is charged with grand theft for stuffing 65 quenchers from a store into her car boot.
"Parklife: Doja Cat, Disclosure and J Hus to headline in Manchester","Tue, 23 Jan 2024 17:21:42 GMT",https://www.bbc.co.uk/news/uk-england-manchester-68074464,"Organisers of the Manchester festival say the line-up is the ""invitation everyone's been waiting for""."
Health adviser denies giving Yousaf Covid rule 'workaround',"Tue, 23 Jan 2024 16:27:27 GMT",https://www.bbc.co.uk/news/uk-scotland-68066907,Prof Jason Leitch told then-health secretary to keep a drink in his hand to remain exempt from mask rules.
May horrified to learn about risks of diabetes disordered eating,"Tue, 23 Jan 2024 12:57:50 GMT",https://www.bbc.co.uk/news/health-68057324,"Better awareness and more NHS support are needed, the former prime minister says."
China appears to U-turn on 'obsessive' gaming crackdown,"Tue, 23 Jan 2024 15:56:25 GMT",https://www.bbc.co.uk/news/technology-68068440,The video game regulator had drafted rules which would have limited the time and money spent gaming.
Israel-Gaza war: IDF says 24 soldiers killed in Gaza in one day,"Tue, 23 Jan 2024 19:59:49 GMT",https://www.bbc.co.uk/news/world-middle-east-68065903,Monday was the deadliest day for Israel since the start of its ground operation.
Amazon fined for 'excessive' surveillance of workers,"Tue, 23 Jan 2024 14:05:42 GMT",https://www.bbc.co.uk/news/business-68067022,The online retail giant was found to be keeping detailed data on employee working patterns.
Dramatic footage shows moment car smashes into cafÃ© window in Italy,"Tue, 23 Jan 2024 09:09:48 GMT",https://www.bbc.co.uk/news/world-europe-68065924,Customers were enjoying their breakfast when the vehicle ploughed into the local coffee shop.
Mr Kipling owner Premier Foods planning further price cuts,"Tue, 23 Jan 2024 14:43:01 GMT",https://www.bbc.co.uk/news/business-68069131,"Premier Foods, which also owns the Bisto and Loyd Grossman brands, plans price cuts to more products."
Chiapas violence: Hundreds flee cartel battles in southern Mexico,"Tue, 23 Jan 2024 13:37:21 GMT",https://www.bbc.co.uk/news/world-latin-america-68067681,"Two rival cartels are fighting for territory in southern Chiapas state, displacing entire communities."
Chelsea reach Carabao Cup final: Mauricio Pochettino 'desperate' for first trophy in England,"Tue, 23 Jan 2024 23:55:54 GMT",https://www.bbc.co.uk/sport/football/68076765,"Mauricio Pochettino says he is ""desperate"" to win his first trophy in English football after leading Chelsea to the EFL Cup final."
Heart of Midlothian 3-2 Dundee: Hosts come from two down to tighten grip on third place,"Tue, 23 Jan 2024 23:20:03 GMT",https://www.bbc.co.uk/sport/football/67247477,"Hearts turn Tynecastle from ""toxic"" to triumphant as they come from two goals down to beat Dundee in a Scottish Premiership thriller and move eight points clear in third."
Chelsea 6-1 Middlesbrough (Agg: 6-2): Blues blow away Boro to reach Carabao Cup final,"Tue, 23 Jan 2024 21:58:16 GMT",https://www.bbc.co.uk/sport/football/67989655,Chelsea reach the EFL Cup final as they blow away second-tier Middlesbrough in the second leg at Stamford Bridge to seal a 6-2 aggregate victory.
India v England: Shoaib Bashir returns to UK to resolve visa issues,"Tue, 23 Jan 2024 18:00:04 GMT",https://www.bbc.co.uk/sport/cricket/68069287,Spinner Shoaib Bashir returns to the UK in order to sort the visa delay which is preventing him from joining the England squad in India.
Afcon 2023:The Gambia 2-3 Cameroon - highlights,"Tue, 23 Jan 2024 20:19:40 GMT",https://www.bbc.co.uk/sport/av/football/68012598,Watch highlights as Cameroon reach the last 16 at the African Cup of Nations with a dramatic 3-2 win over The Gambia.
Afcon 2023: Mauritania 1-0 Algeria - Two-time champions dumped out at group stage,"Tue, 23 Jan 2024 22:50:33 GMT",https://www.bbc.co.uk/sport/football/67989627,Algeria crash out of the 2023 Africa Cup of Nations as Mauritania claim a famous first win at the finals to snatch a last-16 spot.
"Australian Open 2024: Zheng, Yastremska, Noskova & Kalinskaya aim for Melbourne final","Tue, 23 Jan 2024 15:21:28 GMT",https://www.bbc.co.uk/sport/tennis/68057159,"One of Zheng Qinwen, Dayana Yastremska, Linda Noskova or Anna Kalinskaya will be a Grand Slam finalist this weekend - BBC Sport looks at the contenders."
"Russia risked lives in downed plane, Volodymyr Zelensky says","Wed, 24 Jan 2024 22:54:36 GMT",https://www.bbc.co.uk/news/world-europe-68083739,Volodymyr Zelensky accuses Russia after a deadly plane crash claimed the lives of Ukrainian PoWs.
Downed plane: Still unanswered questions amid Ukraine and Russia claims,"Wed, 24 Jan 2024 22:01:50 GMT",https://www.bbc.co.uk/news/world-europe-68089698,"Warfare can come in the form of battle or information control, and Russia has a history of brazen lies."
Asante Gold: UK to loan back Ghana's looted 'crown jewels',"Wed, 24 Jan 2024 22:01:41 GMT",https://www.bbc.co.uk/news/entertainment-arts-68066877,"Treasures taken 150 years ago will go back, the BBC can reveal, in a possible model for other disputes."
Norwich deaths: Girls died of knife wounds,"Wed, 24 Jan 2024 20:06:15 GMT",https://www.bbc.co.uk/news/uk-england-norfolk-68079209,"The deaths of two girls and a woman at the house are being treated as murder, police say."
"Nottingham killer was 'most evil person', says victim's son","Wed, 24 Jan 2024 19:45:14 GMT",https://www.bbc.co.uk/news/uk-england-nottinghamshire-68088132,"In an exclusive interview with the BBC, Ian Coates's family brand Valdo Calocane a ""coward""."
US scientist recommends adding salt to make perfect cup of tea,"Wed, 24 Jan 2024 20:01:00 GMT",https://www.bbc.co.uk/news/uk-68085304,"The US Embassy describes Prof Michelle Francl's suggested tea recipe as an ""unthinkable notion""."
Brit Awards: Raye breaks record as women dominate 2024 nominations,"Wed, 24 Jan 2024 16:30:27 GMT",https://www.bbc.co.uk/news/entertainment-arts-68084174,The chart-topping star becomes the first artist to score seven nominations in a single year.
"Child obesity in pandemic could have lifelong effects, study says","Wed, 24 Jan 2024 19:02:12 GMT",https://www.bbc.co.uk/news/health-68068199,Researchers say children who gained weight in the pandemic could develop diseases later in life.
"Britain must train citizen army, military chief warns","Wed, 24 Jan 2024 18:19:56 GMT",https://www.bbc.co.uk/news/uk-68086188,General Sir Patrick Sanders points to threat of Russia as he warns of UK's lack of readiness for war.
Investigator still believes cleared sub-postmaster was guilty,"Wed, 24 Jan 2024 14:33:53 GMT",https://www.bbc.co.uk/news/business-68009769,Raymond Grant told the inquiry he still thought the branch manager he investigated had stolen money.
Kenneth Eugene Smith: Top US court refuses to block nitrogen gas execution in Alabama,"Wed, 24 Jan 2024 23:11:42 GMT",https://www.bbc.co.uk/news/world-us-canada-68089279,The Supreme Court's decision has paved the way for the first-ever execution by nitrogen gas in the US
Holocaust survivors criticise plans for new Westminster memorial,"Wed, 24 Jan 2024 20:39:00 GMT",https://www.bbc.co.uk/news/uk-politics-68085242,"MPs are told the proposals are ""completely idiotic"" and could fuel antisemitism."
Speedboat killer Jack Shepherd freed from jail,"Wed, 24 Jan 2024 18:14:32 GMT",https://www.bbc.co.uk/news/uk-england-london-68083296,Shepherd was jailed for manslaughter after Charlotte Brown was thrown from a speedboat on the Thames.
Oscar nominations 2024: Barbie's snubs and five more talking points,"Wed, 24 Jan 2024 14:13:05 GMT",https://www.bbc.co.uk/news/entertainment-arts-68067403,"Tuesday's Oscar nominations infuriated some film fans, but many awards experts were less surprised."
Michael Owen: I'd pay anything for my son to see again,"Wed, 24 Jan 2024 06:09:01 GMT",https://www.bbc.co.uk/news/disability-68076555,The father and son on getting to grips with a degenerative eye condition.
Skepta: I?™m bored of the black James Bond narrative,"Wed, 24 Jan 2024 02:52:57 GMT",https://www.bbc.co.uk/news/entertainment-arts-68006229,"The grime artist says his debut film is the backstory of a ""hitman who works for the secret service""."
Ukrainian-born model winning Miss Japan re-ignites identity debate,"Wed, 24 Jan 2024 09:25:05 GMT",https://www.bbc.co.uk/news/world-asia-68078061,A beauty queen has once again re-ignited a debate on what it means to be Japanese.
Myanmar's army is losing - and facing fire from a militant monk,"Tue, 23 Jan 2024 22:28:04 GMT",https://www.bbc.co.uk/news/world-asia-68038513,A challenge from ultra-nationalist Buddhist monks is piling pressure on the loathed coup leader.
IVF hope for world's last two northern white rhinos,"Wed, 24 Jan 2024 11:02:00 GMT",https://www.bbc.co.uk/news/science-environment-68064432,A fertility breakthrough offers hope for saving the northern white rhino from extinction.
Spurs-linked billionaire pleads guilty to insider trading,"Wed, 24 Jan 2024 18:39:18 GMT",https://www.bbc.co.uk/news/world-us-canada-68025903,"One of the UK's richest people admitted his role in a scheme which ""netted millions""."
Khan Younis: UN says nine killed at Gaza shelter as fighting rages,"Wed, 24 Jan 2024 22:47:17 GMT",https://www.bbc.co.uk/news/world-middle-east-68078580,"A UN agency says tank fire hit a college in Khan Younis, but Israel rules out a strike by its forces."
Bob Marley fans Harry and Meghan attend film premiere,"Wed, 24 Jan 2024 21:22:18 GMT",https://www.bbc.co.uk/news/uk-68086080,The Duke and Duchess of Sussex appear at event in Jamaica remembering the life of the reggae star.
Saudi Arabia to get first alcohol shop in more than 70 years,"Wed, 24 Jan 2024 18:57:12 GMT",https://www.bbc.co.uk/news/world-middle-east-68085190,The Saudi government plans a store in Riyadh for foreign diplomats - ending decades of prohibition.
"I'm acting alone, says Simon Clarke after calling for PM to go","Wed, 24 Jan 2024 18:57:42 GMT",https://www.bbc.co.uk/news/uk-politics-68083936,But Sir Simon Clarke tells the BBC some other Tory MPs privately agree Rishi Sunak should be removed.
Thatchers lose trademark fight with Aldi over rival cider drinks,"Wed, 24 Jan 2024 18:10:59 GMT",https://www.bbc.co.uk/news/uk-england-somerset-68086529,"A High Court judge rules there is a ""low degree of similarity"" between the two cider products."
Grace O'Malley-Kumar: Mum wants mandatory jail terms for knife carrying,"Wed, 24 Jan 2024 13:24:49 GMT",https://www.bbc.co.uk/news/uk-68082036,The devastated parents of Grace O'Malley-Kumar say knife crime needs to be urgently examined.
Parents taking children out of Raac schools - union,"Wed, 24 Jan 2024 17:45:25 GMT",https://www.bbc.co.uk/news/articles/c989vqnw4ngo,"Parents are taking their children out of schools with dangerous concrete, a head teachers??union says."
Post Office scandal: Former postmaster's joy after conviction quashed,"Wed, 24 Jan 2024 15:45:06 GMT",https://www.bbc.co.uk/news/uk-scotland-tayside-central-68067244,"Rab Thomson, from Clackmannanshire, is the fifth person in Scotland to have their conviction overturned."
Inside the nine-month cruise going viral on TikTok,"Wed, 24 Jan 2024 15:56:45 GMT",https://www.bbc.co.uk/news/newsbeat-68082624,Videos under the hashtag #ultimateworldcruise have over 353 million views - but what's life like on board?
Liverpool see off Fulham to set up EFL Cup final against Chelsea,"Wed, 24 Jan 2024 23:32:48 GMT",https://www.bbc.co.uk/sport/football/68002571,"Liverpool ""can never take these things for granted"" as they see off Fulham to set up a Carabao Cup final with Chelsea, says manager Jurgen Klopp."
Clement 'wants more' after Rangers cut Celtic's lead,"Wed, 24 Jan 2024 23:26:14 GMT",https://www.bbc.co.uk/sport/football/67937414,"Philippe Clement wants ""to see more and more"" from his Rangers side after they eased to within five points of Scottish Premiership leaders Celtic with a fifth straight victory over Hibernian."
"India v England: Relaxed, fit tourists look for series win for the ages","Wed, 24 Jan 2024 14:52:25 GMT",https://www.bbc.co.uk/sport/cricket/68069988,"England's record in India is better than most, but merely staying competitive will be a fine achievement, writes Stephan Shemilt."
Australian Open 2024: Aryna Sabalenka seeks 'revenge' against Coco Gauff in semi-final,"Wed, 24 Jan 2024 15:34:34 GMT",https://www.bbc.co.uk/sport/tennis/68082718,"Defending champion Aryna Sabalenka is out for ""revenge"" when she takes on American teenager Coco Gauff for a place in the Australian Open final."
Chelsea 2-1 Real Madrid: Emma Hayes' side progress to Women's Champions League quarter-finals as group winners,"Wed, 24 Jan 2024 22:53:19 GMT",https://www.bbc.co.uk/sport/football/68076567,Chelsea are through to the quarter-finals of the Women's Champions League as group winners after grinding out a victory over Real Madrid at Stamford Bridge.
Hot wheels - how wheelchair tennis became a Grand Slam draw,"Thu, 25 Jan 2024 00:00:41 GMT",https://www.bbc.co.uk/sport/disability-sport/68000237,"""It didn't feel huge,"" said Jayant Mistry of playing wheelchair tennis at the 2002 Australian Open. But bringing the sport into the Grand Slam spotlight for the first time changed everything."
Afcon 2023: Zambia 0-1 Morocco ??highlights,"Wed, 24 Jan 2024 22:45:53 GMT",https://www.bbc.co.uk/sport/av/football/68090010,Watch highlights as Morocco beat Zambia 1-0 to finish top of group F and reach the Africa Cup of Nations last 16.
'I just love you': Tim Scott and Donald Trump's other challengers fall in line,"Wed, 24 Jan 2024 17:36:57 GMT",https://www.bbc.co.uk/news/world-us-canada-68077091,Tim Scott and Vivek Ramaswamy stumped for Donald Trump and raised speculation about their future ambitions.
"New Hampshire primary: Nikki Haley fights on, but this is Trump's party now","Wed, 24 Jan 2024 08:08:11 GMT",https://www.bbc.co.uk/news/world-us-canada-68077743,"The former president forges a clear path to the 2024 presidential nomination, writes Anthony Zurcher."
New Hampshire primary: How did Joe Biden win despite not being on the ballot?,"Wed, 24 Jan 2024 16:17:42 GMT",https://www.bbc.co.uk/news/world-us-canada-68077090,"Thanks to a campaign for voters to write his name on the ballot, the president easily brushes aside a longshot challenger in Democratic vote."
'Trump is our last shot at restoring America',"Tue, 23 Jan 2024 14:04:56 GMT",https://www.bbc.co.uk/news/world-us-canada-68053918,Voters in New Hampshire backing the former president say the economy is the key issue driving their support.
US election 2024: A really simple guide,"Wed, 24 Jan 2024 08:52:41 GMT",https://www.bbc.co.uk/news/world-us-canada-67285325,Trying to understand it for the first time or need a refresher? This guide can help.
What a Donald Trump second term would look like,"Fri, 03 Nov 2023 22:09:06 GMT",https://www.bbc.co.uk/news/world-us-canada-67272569,"If he returns to the White House by winning the 2024 election, here is what he has said he wants to do."
"Post Office plan to sack Horizon IT reviewer kept secret, documents reveal","Fri, 26 Jan 2024 00:01:29 GMT",https://www.bbc.co.uk/news/business-68079300,"Records also show managers planned to pay only a ""token"" sum as part of ""mediation"" to deal with victims."
Nottingham attacks: Families' anger as triple killer gets hospital order,"Thu, 25 Jan 2024 22:35:32 GMT",https://www.bbc.co.uk/news/uk-england-nottinghamshire-68087302,"The mother of one of Valdo Calocane's victims says ""true justice has not been served""."
Watch: Killer's rampage and arrest caught on camera,"Thu, 25 Jan 2024 13:21:57 GMT",https://www.bbc.co.uk/news/uk-england-nottinghamshire-68095900,Video released by police shows Valdo Calocane's movements and arrest in the Nottingham attacks.
UK halts trade negotiations with Canada over hormones in beef ban,"Thu, 25 Jan 2024 22:58:43 GMT",https://www.bbc.co.uk/news/uk-politics-68098177,Talks aimed at extending a rolled-over EU-era deal broke down over Britain's ban on hormone-treated meat.
Defiant Trump takes legal risk on stand in New York defamation trial,"Thu, 25 Jan 2024 22:58:11 GMT",https://www.bbc.co.uk/news/world-us-canada-68071744,The lawyers and the judge spent more time arguing about the scope of the former president's testimony.
Ingenuity: Damage puts end to ground-breaking Mars helicopter mission,"Thu, 25 Jan 2024 22:37:26 GMT",https://www.bbc.co.uk/news/science-environment-68099672,The first vehicle to achieve powered flight on another planet suffers rotor damage three years into tour.
Norwich deaths: Police took father to hospital weeks before stabbings,"Thu, 25 Jan 2024 22:03:03 GMT",https://www.bbc.co.uk/news/uk-england-norfolk-68100719,"Bartlomiej Kuczynski was taken to hospital by police the day he was reported missing, it is revealed."
Ukrainian intelligence does not rule out PoWs on downed Russian plane,"Thu, 25 Jan 2024 21:24:12 GMT",https://www.bbc.co.uk/news/world-europe-68101731,"Intelligence officer says he cannot exclude possibility, but adds that Russia has provided no proof."
"Constance Marten trial: Baby kept in Lidl bag before being dumped, court told","Thu, 25 Jan 2024 17:35:54 GMT",https://www.bbc.co.uk/news/uk-68080832,Constance Marten and her partner Mark Gordon are on trial for the manslaughter of their newborn baby.
Michigan school shooter's mum weeps as she goes on trial,"Thu, 25 Jan 2024 23:43:56 GMT",https://www.bbc.co.uk/news/world-us-canada-68102109,Jennifer Crumbley is the first US parent to face a manslaughter trial for such an attack by their child.
Dancer with allergy eats mislabelled cookie and dies,"Thu, 25 Jan 2024 23:49:08 GMT",https://www.bbc.co.uk/news/world-us-canada-68102202,"The English dancer, 25, died from anaphylactic shock after consuming a mislabelled cookie from a US grocery chain."
Turkey: Watch plane's emergency descent over motorway,"Thu, 25 Jan 2024 21:58:11 GMT",https://www.bbc.co.uk/news/world-europe-68099144,Footage shows a military plane flying over a motorway in Turkey after it experienced a technical issue.
Dragons' Den: BBC defends show after ME criticism of Acu Seeds,"Thu, 25 Jan 2024 20:30:55 GMT",https://www.bbc.co.uk/news/entertainment-arts-68097756,"Campaigners say ""unfounded"" claims had been made about a product pitched on the series."
The Papers: Mone's assets frozen and Nottingham 'victims failed',"Thu, 25 Jan 2024 23:54:24 GMT",https://www.bbc.co.uk/news/blogs-the-papers-68101957,Friday's newspapers reflect on fury from the families of the three victims fatally stabbed in Nottingham.
Social media: Trolls target cancer survivor over wigs,"Thu, 25 Jan 2024 23:00:15 GMT",https://www.bbc.co.uk/news/uk-wales-68097150,"Aimee Bannister continues to wear wigs after getting the all-clear, but receives abusive messages."
UK citizen army: Preparing the 'pre-war generation' for conflict,"Thu, 25 Jan 2024 16:35:34 GMT",https://www.bbc.co.uk/news/uk-68097048,A senior general stops short of backing conscription - but wants the UK to prepare for wider European war.
Australia Day: The 'quiet rebranding' of a controversial national holiday,"Thu, 25 Jan 2024 21:48:37 GMT",https://www.bbc.co.uk/news/world-australia-68014555,The national day causes pain to Indigenous people - will new approaches future-proof it?
How nitrogen became a form of execution in the US,"Thu, 25 Jan 2024 23:01:39 GMT",https://www.bbc.co.uk/news/world-us-canada-68102304,An Alabama death row inmate is expected to become the first person executed with the deadly gas.
Why a key crime stat doesn't tell the full story about sexual offences,"Thu, 25 Jan 2024 09:24:49 GMT",https://www.bbc.co.uk/news/uk-68070671,A measure routinely highlighted does not include major types of crimes that affect women more than men.
