title,pubDate,guid,description
Suspected Israeli strike in Lebanon kills senior Hezbollah commander,"Mon, 08 Jan 2024 17:03:48 GMT",https://www.bbc.co.uk/news/world-middle-east-67914727,"Hezbollah confirmed the death of Wissam Tawil, marking a further escalation of tensions with Israel."
Christopher Kapessa: Drowned boy's family 'racially abused',"Mon, 08 Jan 2024 15:37:22 GMT",https://www.bbc.co.uk/news/uk-wales-67911288,The mother of Christopher Kapessa says family members were assaulted and received hate mail.
More than 200 jobs lost as housebuilder Stewart Milne goes bust,"Mon, 08 Jan 2024 22:51:44 GMT",https://www.bbc.co.uk/news/uk-scotland-north-east-orkney-shetland-67918029,The north-east Scotland based Stewart Milne Group failed to attract any viable offers after being put up for sale.
Franz Beckenbauer: German legend was one of football's most important figures,"Mon, 08 Jan 2024 19:50:26 GMT",https://www.bbc.co.uk/sport/football/67918946,"Franz Beckenbauer, who has died aged 78, was the friend of Sir Bobby Charlton, Bobby Moore and Pele and one of football's most important figures."
Alaskan Airlines flight 1282: Key questions behind door plug blowout,"Mon, 08 Jan 2024 18:46:55 GMT",https://www.bbc.co.uk/news/world-us-canada-67915771,Many questions remain after a 737 Max Boeing plane suffered a mid-air blowout in the US.
?˜Terrible things happened??- inside Nigerian preacher?™s church of horrors,"Mon, 08 Jan 2024 00:05:00 GMT",https://www.bbc.co.uk/news/world-africa-67861976,Rae was 21 when she became a charismatic Nigerian preacher?™s disciple - and suffered years of abuse.
"Margot Robbie, Taylor Swift and more on Golden Globes red carpet","Mon, 08 Jan 2024 03:23:58 GMT",https://www.bbc.co.uk/news/entertainment-arts-67908727,Stars including Margot Robbie and Taylor Swift arrived in a variety of eye-catching outfits.
'Thank you Bob': Search for plane's blown-out panel ended by teacher,"Mon, 08 Jan 2024 20:23:35 GMT",https://www.bbc.co.uk/news/world-us-canada-67911193,An Oregon teacher named Bob is thanked by investigators after finding a missing door plug in a yard.
Back-to-school illness advice offered to parents,"Mon, 08 Jan 2024 03:11:55 GMT",https://www.bbc.co.uk/news/health-67894937,Health officials explain when to keep your child at home and how to stop the spread of bugs.
"Is Jeremy Hunt right about Â£1,000 National Insurance saving?","Mon, 08 Jan 2024 17:10:40 GMT",https://www.bbc.co.uk/news/uk-politics-67912689,"Chancellor Jeremy Hunt claims National Insurance cut is worth 'nearly Â£1,000 for a typical two-earner family'."
The dark rumours trying to destroy Taiwan's trust in the US,"Mon, 08 Jan 2024 01:17:37 GMT",https://www.bbc.co.uk/news/world-asia-67891869,"Beijing is pushing ""US scepticism"" to drive a wedge between Taiwan and its biggest ally, say analysts."
Post Office scandal explained: What the Horizon saga is all about,"Mon, 08 Jan 2024 13:10:25 GMT",https://www.bbc.co.uk/news/business-56718036,The background to the cases of sub-postmasters whose convictions were based on evidence from faulty IT.
Izzy Judd: 'Music let my brother in a coma connect with us',"Mon, 08 Jan 2024 07:07:23 GMT",https://www.bbc.co.uk/news/uk-england-beds-bucks-herts-67885844,"Rupert Johnston was left brain damaged after a car crash, but his prolific musical ability lives on."
How portable X-ray machines are helping remote patients,"Mon, 08 Jan 2024 00:08:13 GMT",https://www.bbc.co.uk/news/business-67871981,Portable X-ray equipment that can take high quality images is transforming healthcare in remote areas.
Refunds after delays on UK's first battery-powered trains,"Mon, 08 Jan 2024 19:34:09 GMT",https://www.bbc.co.uk/news/uk-england-merseyside-67917719,Kirkby was the UK's first line with battery-powered trains but has been plagued with delays.
Jack Diamond: Sunderland footballer cleared of rape,"Mon, 08 Jan 2024 17:32:38 GMT",https://www.bbc.co.uk/news/uk-england-wear-67883460,Jack Diamond denied raping and sexually assaulting a woman he had a sex-based relationship with.
James Morrison's partner Gill Catchpole found dead at their home,"Mon, 08 Jan 2024 14:57:48 GMT",https://www.bbc.co.uk/news/uk-england-gloucestershire-67910325,Ms Catchpole is the mother of Mr Morrison's two daughters and they were together for two decades.
"'Dude, woah' - sparks fly as tornado rips through Florida city","Mon, 08 Jan 2024 16:47:44 GMT",https://www.bbc.co.uk/news/world-us-canada-67917068,A tornado moved through downtown Fort Lauderdale Saturday evening hitting power cables and buildings.
The Receipts Podcast: Tolly T and Audrey address Milena Sanchez rift,"Mon, 08 Jan 2024 16:42:56 GMT",https://www.bbc.co.uk/news/newsbeat-67913027,"Milena Sanchez says she felt at her ""wits' end"" when she quit The Receipts in October last year."
Tiger Woods and Nike end 27-year partnership,"Mon, 08 Jan 2024 23:48:27 GMT",https://www.bbc.co.uk/news/business-67916788,Woods became synonymous with Nike as they joined forces on his rise to the top in the late 1990s.
"Oil and gas legislation is total distraction, senior Tory says","Mon, 08 Jan 2024 21:55:37 GMT",https://www.bbc.co.uk/news/uk-politics-67913795,Former minister Sir Alok Sharma says he will not vote for plans to guarantee annual oil and gas licensing rounds.
Bet365 boss Denise Coates sees pay jump to Â£221m,"Mon, 08 Jan 2024 15:52:57 GMT",https://www.bbc.co.uk/news/business-67912483,"The firm's founder has earned more than Â£1bn over four years but campaigners say it is not ""fair""."
Apple pays out over claims it deliberately slowed down iPhones,"Mon, 08 Jan 2024 13:06:27 GMT",https://www.bbc.co.uk/news/technology-67911517,The tech giant is compensating US customers and faces similar allegations in the UK.
Australia puts republic referendum plan on hold,"Mon, 08 Jan 2024 17:49:37 GMT",https://www.bbc.co.uk/news/world-australia-67916228,"A minister says holding a vote on removing King Charles III as head of state is ""not a priority""."
"Luke Littler, 16, to make World Series debut in Bahrain","Mon, 08 Jan 2024 16:03:17 GMT",https://www.bbc.co.uk/sport/darts/67916066,Sixteen-year-old Luke Littler will make his World Series debut this month after becoming the youngest player to reach the PDC World Championship final.
Biden tells heckler he's pushing Israel to leave Gaza,"Mon, 08 Jan 2024 18:28:25 GMT",https://www.bbc.co.uk/news/world-us-canada-67886694,The president makes the comments after being interrupted by 'ceasefire now' chants in South Carolina.
Alaska Airlines plane had warnings days before mid-air blowout,"Mon, 08 Jan 2024 20:53:51 GMT",https://www.bbc.co.uk/news/world-us-canada-67909417,"The jet involved in Friday's incident had been prevented from long trips over water, US investigators say."
Love Island All Stars: ITV reveals line-up for 2024 series,"Mon, 08 Jan 2024 11:55:31 GMT",https://www.bbc.co.uk/news/newsbeat-67911425,"ITV's new series will see the return of islanders like Georgia Harrison, Kaz Kamwi and Anton Danyluk."
Idris Elba urges stronger action on knife crime,"Mon, 08 Jan 2024 16:52:42 GMT",https://www.bbc.co.uk/news/entertainment-arts-67903124,The actor teams up with victims' families to demand action and releases a single called Knives Down.
Wigan 0-2 Man Utd: Erik ten Hag's side see off League One Latics in FA Cup,"Mon, 08 Jan 2024 23:11:43 GMT",https://www.bbc.co.uk/sport/football/67914807,Manchester United prove too strong for League One Wigan Athletic as Erik ten Hag's side move into the fourth round of the FA Cup.
FA Cup 2024: Wigan Athletic 0-2 Manchester United - highlights,"Mon, 08 Jan 2024 22:46:57 GMT",https://www.bbc.co.uk/sport/av/football/67873557,Watch highlights as goals from Diogo Dalot and Bruno Fernandes see Manchester United beat Wigan Athletic 2-0 to reach the FA Cup fourth round.
Wigan 0-2 Man Utd: Bruno Fernandes scores Man Utd's second from spot but Matt Upson questions decision to award penalty,"Mon, 08 Jan 2024 22:45:20 GMT",https://www.bbc.co.uk/sport/av/football/67919330,Bruno Fernandes scores Man Utd's second from spot but Matt Upson questions decision to award penalty which secures a 2-0 FA Cup third round victory for the Red Devils at Wigan.
JPR Williams obituary: The Wales and Lions full-back who never took a backward step,"Mon, 08 Jan 2024 22:30:27 GMT",https://www.bbc.co.uk/sport/rugby-union/52052510,The legendary Wales and British and Irish Lions full-back JPR Williams was one of those special sporting stars who was known by his initials.
Thierry Henry says he had depression throughout his playing career,"Mon, 08 Jan 2024 21:25:52 GMT",https://www.bbc.co.uk/sport/football/67918952,"Former Arsenal striker Thierry Henry says he ""must have been in depression"" during his playing career."
Franz Beckenbauer: The German football icon's incredible career including World Cup wins as player and manager,"Mon, 08 Jan 2024 18:46:36 GMT",https://www.bbc.co.uk/sport/av/football/67918656,BBC Sport looks back at Franz Beckenbauer's incredible career and his success at the World Cup as both a player and a manager after the German football legend passed away aged 78.
Emma Raducanu reunites with coach Nick Cavaday before Australian Open,"Mon, 08 Jan 2024 11:04:09 GMT",https://www.bbc.co.uk/sport/tennis/67910707,Emma Raducanu reunites with childhood coach Nick Cavaday in time for the Australian Open where she will play her first Grand Slam for a year.
Golden Globes 2024: Oppenheimer and Succession sweep up,"Mon, 08 Jan 2024 04:43:13 GMT",https://www.bbc.co.uk/news/entertainment-arts-67908835,"Da'Vine Joy Randolph, Emma Stone and Barbie are among the other award winners."
Host Jo Koy's jokes fall flat and six other Golden Globes moments,"Mon, 08 Jan 2024 06:24:43 GMT",https://www.bbc.co.uk/news/entertainment-arts-67908840,"One commentator joked his monologue was ""a bomb"" and viewers also commented on his one-liners."
Spirited Away director Miyazaki wins first Golden Globe at 82,"Mon, 08 Jan 2024 04:37:43 GMT",https://www.bbc.co.uk/news/world-asia-67909246,The legendary director's win marks the first Golden Globe award for a non-English animated feature.
See the full list of winners,"Mon, 08 Jan 2024 01:20:53 GMT",https://www.bbc.co.uk/news/entertainment-arts-67908749,"Oppenheimer wins five prizes, while Anatomy of a Fall, The Holdovers and Poor Things score two each."
How to save money even when the budget is tight,"Mon, 08 Jan 2024 10:01:58 GMT",https://www.bbc.co.uk/news/business-66855566,"The interest paid on savings is better than anything seen for years, so how can you save when bills are rising?"
National Insurance calculator: What will I pay and how is tax changing?,"Sat, 06 Jan 2024 01:21:42 GMT",https://www.bbc.co.uk/news/explainers-63635185,"National Insurance rates are falling, but other changes mean many people are paying more tax."
Ex-Post Office boss to hand back CBE over IT scandal,"Tue, 09 Jan 2024 21:44:09 GMT",https://www.bbc.co.uk/news/uk-67925304,"Paula Vennells says she has ""listened"" to those calling for her to return the honour."
Post Office scandal: 'Racism affected how we were treated over Horizon',"Tue, 09 Jan 2024 23:46:20 GMT",https://www.bbc.co.uk/news/uk-67929650,The workers say they believe racism affected the way people were treated in the Horizon scandal
Ecuador: Gunmen storm television studio live on air,"Tue, 09 Jan 2024 22:06:25 GMT",https://www.bbc.co.uk/news/world-latin-america-67930452,Footage shows armed men wearing masks surrounding journalists in the Guayaquil-based newsroom.
Trump hearing: Judges sound sceptical of Trump's immunity defence,"Tue, 09 Jan 2024 22:49:26 GMT",https://www.bbc.co.uk/news/world-us-canada-67920129,"The justice department called the ex-president's claim of total immunity from prosecution ""frightening""."
2023 confirmed as world's hottest year on record,"Tue, 09 Jan 2024 12:00:24 GMT",https://www.bbc.co.uk/news/science-environment-67861954,"Climate records tumbled ""like dominoes"" in 2023, with temperatures far above any recorded level."
Israel-Gaza war: Blinken says cost of conflict on children far too high,"Tue, 09 Jan 2024 20:46:28 GMT",https://www.bbc.co.uk/news/world-us-canada-67929616,The US Secretary of State says the creation of a Palestinian state is vital for long-term peace in the region.
South Korea: Dog meat still on the menu in Seoul... for now,"Tue, 09 Jan 2024 15:36:54 GMT",https://www.bbc.co.uk/news/world-asia-67921569,The BBC reports from one of the few places in the city where you can eat dog meat ahead of a ban.
Mortgages: Barclays and Santander cut rates as competition intensifies,"Tue, 09 Jan 2024 22:39:56 GMT",https://www.bbc.co.uk/news/business-67925256,Two big lenders cut their mortgage rates as the battle for those seeking a new deal continues.
Tory group of MPs aim to force changes to Rwanda Bill,"Tue, 09 Jan 2024 23:47:45 GMT",https://www.bbc.co.uk/news/uk-politics-67930783,"Former minister Robert Jenrick leads a group of 40 would-be rebels looking to ""strengthen"" the bill."
Watch: Laser shone at air ambulance helicopter,"Tue, 09 Jan 2024 14:39:19 GMT",https://www.bbc.co.uk/news/uk-england-norfolk-67926839,"Video shows a bright green flashing at the aircraft, an offence officials say could endanger lives."
Carabao Cup: Middlesbrough 1-0 Chelsea: Hosts earn slender advantage in semi-final first leg,"Tue, 09 Jan 2024 23:12:45 GMT",https://www.bbc.co.uk/sport/football/67860193,Chelsea miss a host of chances as Championship side Middlesbrough earn a slender advantage in the first leg of their EFL Cup semi-final at a boisterous Riverside.
Midwife quit over 'unsafe care' and staffing,"Tue, 09 Jan 2024 03:07:02 GMT",https://www.bbc.co.uk/news/health-67732916,Other NHS workers have risen in number five times more than midwives over the past decade.
"From Bill to Michael, why Mr Haley switched names","Tue, 09 Jan 2024 09:43:14 GMT",https://www.bbc.co.uk/news/world-us-canada-67899302,Nikki Haley wrote in her 2012 book that she suggested her husband change his name from Bill to Michael.
"TB Joshua?™s daughter: Tortured after standing up to ?˜Daddy??""Wed"," 10 Jan 2024 00:00:11 GMT""",https://www.bbc.co.uk/news/world-africa-67923906,The first person to blow the whistle on the abuse at the megapastor's church was his young daughter.
All India Pregnant Job service: The Indian men who fell for the scam,"Wed, 10 Jan 2024 00:00:22 GMT",https://www.bbc.co.uk/news/world-asia-india-67860456,The conmen in Bihar state promised to pay huge sums of money to men to get childless women pregnant.
US Moon mission has no chance of soft lunar landing,"Tue, 09 Jan 2024 18:22:03 GMT",https://www.bbc.co.uk/news/science-environment-67929439,US company Astrobotic had hoped to land its Peregrine spacecraft on the Moon next month.
Cuba's spying case that has shocked the US government,"Tue, 09 Jan 2024 00:09:08 GMT",https://www.bbc.co.uk/news/world-latin-america-67913465,Ex-CIA agent says Cuba has 'surpassed the KGB' as a former top US diplomat is charged with spying.
Where will all the electric cars be charged?,"Tue, 09 Jan 2024 00:07:15 GMT",https://www.bbc.co.uk/news/business-67518869,Lampposts and mobile charging machines are being touted as the answer to charging electric cars.
Taiwan election: The party promising peace with China,"Mon, 08 Jan 2024 23:57:49 GMT",https://www.bbc.co.uk/news/world-asia-67909071,"Promising peace with China, the once-dominant KMT faces a difficult balancing act in upcoming polls."
"SinÃ©ad O'Connor died of natural causes, coroner rules","Tue, 09 Jan 2024 14:23:11 GMT",https://www.bbc.co.uk/news/entertainment-arts-67926255,Irish singer died last July at her home in south London aged 56.
Boeing admits mistake over plane door blow-out,"Tue, 09 Jan 2024 23:44:19 GMT",https://www.bbc.co.uk/news/business-67930977,Boeing's boss Dave Calhoun vows to find the cause of the incident on the Alaska Airlines flight.
Eaglescliffe woman found not guilty of 'home abortion',"Tue, 09 Jan 2024 16:51:53 GMT",https://www.bbc.co.uk/news/uk-england-tees-67927099,Bethany Cox was accused of child destruction and using misoprostol to procure her own miscarriage.
Gabriel Attal: Macron's pick for PM is France's youngest at 34,"Tue, 09 Jan 2024 18:03:31 GMT",https://www.bbc.co.uk/news/world-europe-67922062,"Gabriel Attal is named France's next prime minister, as Emmanuel Macron aims to revive his presidency."
Api Ratuniyarawa: Barbarians player jailed for sexual assault,"Tue, 09 Jan 2024 18:04:59 GMT",https://www.bbc.co.uk/news/uk-wales-67920666,Rugby international Api Ratuniyarawa admitted attacking three different women in a bar.
"Inmate 'berated and threatened' before her death, says mother","Tue, 09 Jan 2024 15:38:06 GMT",https://www.bbc.co.uk/news/uk-scotland-glasgow-west-67924142,Katie Allan was said to be incredibly distressed before taking her own life at a young offenders institute.
New material found by AI could reduce lithium use in batteries,"Tue, 09 Jan 2024 16:00:38 GMT",https://www.bbc.co.uk/news/technology-67912033,Microsoft said AI and supercomputing were used to synthesise an entirely new material.
Austrian ski gondola crashes in Hochoetz injuring Danish family,"Tue, 09 Jan 2024 18:42:29 GMT",https://www.bbc.co.uk/news/world-europe-67922066,The gondola is said to have fallen 7m (23ft) at the Hochoetz ski resort in Tyrol.
Christopher Kapessa inquest: Teen seen pushing boy into river,"Tue, 09 Jan 2024 14:14:57 GMT",https://www.bbc.co.uk/news/uk-wales-67923641,A witness tells the Christopher Kapessa inquest he was pushed into the River Cynon.
Boeing plane: New footage shows inspection after dramatic mid-air blowout,"Tue, 09 Jan 2024 00:59:30 GMT",https://www.bbc.co.uk/news/world-us-canada-67919981,US investigators have shared footage from inside the cabin of the grounded Alaskan Airlines plane.
20mph: Mark Drakeford clear as mud on enforcement - top Tory,"Tue, 09 Jan 2024 16:02:58 GMT",https://www.bbc.co.uk/news/uk-wales-politics-67926707,"Mark Drakeford says people ""genuinely confused"" about the new speed limit will not face action."
EA FC 24 was UK's best-selling game in 2023,"Tue, 09 Jan 2024 12:07:18 GMT",https://www.bbc.co.uk/news/newsbeat-67914218,The Fifa successor retained its position at the top of the gaming league table despite a rebrand.
North Korea's Kim Jong Un believed to have turned 40,"Tue, 09 Jan 2024 12:43:39 GMT",https://www.bbc.co.uk/news/world-asia-67920529,"North Korea watchers believe he hit the milestone on Monday, although the state remained silent."
"Apple Vision Pro: $3,499 headset finally gets release date","Tue, 09 Jan 2024 13:19:29 GMT",https://www.bbc.co.uk/news/technology-67922296,Apple's long-awaited mixed-reality headset will launch in the US on 2 February.
September trial date set for youth charged with Harry Pitman's murder,"Tue, 09 Jan 2024 13:24:15 GMT",https://www.bbc.co.uk/news/uk-england-london-67921762,The teenager is also accused of having an offensive weapon following the New Year's Eve stabbing.
Shane MacGowan and SinÃ©ad O'Connor tribute show announced,"Tue, 09 Jan 2024 09:40:27 GMT",https://www.bbc.co.uk/news/entertainment-arts-67921666,"The Irish singers, who both died in 2023, were friends and recorded a duet together in 1995."
Timo Werner: Will Tottenham loan move from RB Leipzig rejuvenate former Chelsea forward?,"Tue, 09 Jan 2024 19:15:56 GMT",https://www.bbc.co.uk/sport/football/67921676,"Timo Werner endured a difficult spell in the Premier League at Chelsea, but will he make the most of his second chance in England with Tottenham?"
"Joey Barton comments on women are 'dangerous', says sports minister Stuart Andrew","Tue, 09 Jan 2024 17:58:25 GMT",https://www.bbc.co.uk/sport/football/67927405,"Former footballer Joey Barton's social media tirade against women working in the men's game is ""not acceptable"", says sports minister Stuart Andrew."
Emma Raducanu: Briton pulls out of charity match before Australian Open,"Tue, 09 Jan 2024 08:16:51 GMT",https://www.bbc.co.uk/sport/tennis/67920598,Britain's Emma Raducanu pulls out of a charity match scheduled to take place on Tuesday at Melbourne Park.
Dejan Kulusevski reveals all about his Tottenham team-mates in The Group Chat,"Tue, 09 Jan 2024 06:10:45 GMT",https://www.bbc.co.uk/sport/av/football/67886100,Dejan Kulusevski reveals what goes on inside Tottenham's group chat.
Dominic Calvert-Lewin: Everton successful in appeal against red card at Crystal Palace,"Tue, 09 Jan 2024 16:00:11 GMT",https://www.bbc.co.uk/sport/football/67922687,Everton are successful in their appeal against the red card shown to Dominic Calvert-Lewin in their FA Cup third-round draw at Crystal Palace.
Mike Vrabel: Tennessee Titans sack head coach after consecutive losing seasons in NFL,"Tue, 09 Jan 2024 21:20:53 GMT",https://www.bbc.co.uk/sport/american-football/67929886,Mike Vrabel is sacked as head coach of the Tennessee Titans after a second consecutive losing season in the NFL.
Post Office scandal: The power of the docudrama to bring about justice,"Tue, 09 Jan 2024 18:20:07 GMT",https://www.bbc.co.uk/news/entertainment-arts-67921673,Mr Bates vs The Post Office is not the only TV series to have helped renew public interest in an issue.
"Fujitsu will be held accountable over Post Office scandal, says government","Tue, 09 Jan 2024 18:17:55 GMT",https://www.bbc.co.uk/news/business-67921298,The firm behind the Horizon software is facing growing calls over its role in the Post Office scandal.
Post Office scandal explained: What the Horizon saga is all about,"Tue, 09 Jan 2024 16:12:43 GMT",https://www.bbc.co.uk/news/business-56718036,The convictions of sub-postmasters were based on evidence from faulty IT.
"I told Post Office the truth about Horizon in 2003, IT expert says","Tue, 09 Jan 2024 14:19:36 GMT",https://www.bbc.co.uk/news/uk-england-lancashire-67921974,"A digital forensic investigator says he told the Post Office that Horizon data was ""unreliable"" in 2003."
Chris Mason: TV drama may help deliver change for postmasters,"Tue, 09 Jan 2024 02:40:23 GMT",https://www.bbc.co.uk/news/uk-politics-67920145,"The Post Office scandal has been catapulted up the political agenda, our political editor writes."
Ex-Walsall postmistress says Post Office charges led to a breakdown,"Tue, 09 Jan 2024 20:54:54 GMT",https://www.bbc.co.uk/news/uk-england-birmingham-67917518,Ex-postmistress Jess Kaur says she ended up in hospital and attempted suicide from her ordeal.
"Pay victims fast, says TV drama inspiration Alan Bates","Mon, 08 Jan 2024 18:45:05 GMT",https://www.bbc.co.uk/news/uk-wales-67916433,Mr Bates inspired an ITV drama about sub-postmasters' battle against the Post Office.
Gloucestershire Post Office managers want justice,"Tue, 09 Jan 2024 08:16:32 GMT",https://www.bbc.co.uk/news/uk-england-bristol-67915188,Nicki Arch and Wendy Buffrey were wrongly accused of stealing thousands in the Horizon scandal.
Ex sub-postmaster: Sunak must take action quickly,"Tue, 09 Jan 2024 06:13:19 GMT",https://www.bbc.co.uk/news/uk-england-essex-67915573,"Former sub-postmaster Ian Warren says his life was ruined when he was wrongly accused of taking Â£18,000."
Post Christmas debt: Which bills should I pay first?,"Mon, 08 Jan 2024 09:18:04 GMT",https://www.bbc.co.uk/news/business-64291327,What help and options are available to people struggling with debt repayments?
What are cold weather payments and how much are they worth?,"Tue, 09 Jan 2024 14:01:21 GMT",https://www.bbc.co.uk/news/business-55992592,Cold weather payments are available to some people after seven days of below-zero temperatures.
Hundreds of Post Office scandal victims to have convictions overturned,"Wed, 10 Jan 2024 19:39:28 GMT",https://www.bbc.co.uk/news/uk-67932595,New laws are to be introduced to clear the names of ex-postmasters caught up in Horizon IT scandal.
Chris Christie exits 2024 White House race with parting shot at Trump,"Wed, 10 Jan 2024 23:48:14 GMT",https://www.bbc.co.uk/news/world-us-canada-67942038,"Mr Christie drops out with a vow not to ""enable"" Donald Trump and a hot mic broadside at another rival."
Boohoo put 'Made in UK' labels on clothes made overseas,"Thu, 11 Jan 2024 00:03:44 GMT",https://www.bbc.co.uk/news/uk-67929755,T-shirts from Pakistan had their labels swapped by workers in fashion firm?™s Leicester factory last year.
Streets empty as Ecuador reels from violence,"Wed, 10 Jan 2024 21:04:16 GMT",https://www.bbc.co.uk/news/world-latin-america-67938285,President Daniel Noboa declares a war on armed gangs after days of violence across the country.
Swedish alarm after defence chiefs' war warning,"Wed, 10 Jan 2024 22:19:04 GMT",https://www.bbc.co.uk/news/world-europe-67935464,A warning to Swedes to prepare for war from two top defence officials prompts accusations of alarmism.
Alexei Navalny jokes in first appearance from new prison,"Wed, 10 Jan 2024 18:44:14 GMT",https://www.bbc.co.uk/news/world-europe-67941119,The Russian opposition leader made his first public appearance in a video call since being moved to an Arctic prison.
Ancient bones shed new light on how multiple sclerosis developed,"Wed, 10 Jan 2024 16:09:53 GMT",https://www.bbc.co.uk/news/health-67917294,The DNA of ancient cattle herders has revealed how diseases evolved in Europe over thousands of years.
Austrian heiress Marlene Engelhorn announces plan for ??5m giveaway,"Wed, 10 Jan 2024 15:47:49 GMT",https://www.bbc.co.uk/news/world-europe-67935463,"Marlene Engelhorn, 31, inherited millions and wants to recruit 50 people to hand most of it out."
"HS2 to Birmingham may cost Â£65bn, railway boss says","Wed, 10 Jan 2024 16:29:02 GMT",https://www.bbc.co.uk/news/business-67932247,Sir Jonathan Thompson says inflation has added up to Â£10bn to cost of London to Birmingham stretch.
